"Authors","Author full names","Author(s) ID","Title","Year","Source title","Volume","Issue","Art. No.","Page start","Page end","Cited by","DOI","Link","Abstract","Author Keywords","Index Keywords","Document Type","Publication Stage","Open Access","Source","EID"
"Guo X.; Chen Y.; Wang Y.","Guo, Xufeng (57224196536); Chen, Yuanbin (57215339032); Wang, Ying (56027276800)","57224196536; 57215339032; 56027276800","Learning-Based Robust and Secure Transmission for Reconfigurable Intelligent Surface Aided Millimeter Wave UAV Communications","2021","IEEE Wireless Communications Letters","10","8","9434412","1795","1799","150","10.1109/LWC.2021.3081464","https://www.scopus.com/inward/record.uri?eid=2-s2.0-85107183144&doi=10.1109%2FLWC.2021.3081464&partnerID=40&md5=b5846d28047844af1bcd8e9539a9f41d","In this letter, we study the robust and secure transmission in the millimeter-wave (mmWave) unmanned aerial vehicle (UAV) communication assisted by a reconfigurable intelligent surface (RIS) under imperfect channel state information (CSI). Specifically, the active beamforming of the UAV, the coefficients of the RIS elements and the UAV trajectory are jointly designed to maximize the sum secrecy rate of all legitimate users in the presence of multiple eavesdroppers. However, the CSI is coupled with the UAV trajectory, which results in complex constraints. Furthermore, the time-related issue caused by the outdated CSI also makes the formulated problem intractable to solve. To tackle these challenges, by leveraging the deep deterministic policy gradient (DDPG) framework, a novel and effective twin-DDPG deep reinforcement learning (TDDRL) algorithm is proposed. Simulation results demonstrate the effectiveness and robustness of the proposed algorithm, and the RIS can significantly improve the sum secrecy rate. © 2012 IEEE.","deep reinforcement learning; millimeter-wave communications; physical layer security; Reconfigurable intelligent surface; unmanned aerial vehicle","Antennas; Channel state information; Deep learning; Interlocking signals; Millimeter waves; Reinforcement learning; Vehicle transmissions; Complex constraints; Formulated problems; Imperfect channel state information; Legitimate users; Millimeter waves (mmwave); Policy gradient; Reconfigurable; Secure transmission; Unmanned aerial vehicles (UAV)","Article","Final","","Scopus","2-s2.0-85107183144"
"Yan C.","Yan, Chaohong (60203924500)","60203924500","Enhancing UAV aeromagnetic data denoising via multi-type noise augmentation and deep learning","2025","Proceedings of SPIE - The International Society for Optical Engineering","13802","","1380213","","","0","10.1117/12.3067860","https://www.scopus.com/inward/record.uri?eid=2-s2.0-105022410175&doi=10.1117%2F12.3067860&partnerID=40&md5=7d909542972006d98c1bce6a38b315d7","In recent years, Unmanned Aerial Vehicle (UAV) aeromagnetic technology has faced challenges in practical applications due to multi-source complex noise arising from electromagnetic interference, dynamic flight trajectories, and sensor instability. Most existing methods rely on single-noise simulations, such as Gaussian noise, to approximate real-world noise for training deep learning models. However, these approaches struggle to effectively capture the diversity and complexity of noise in real-world environments. To address this limitation, this paper proposes a multi-type noise data augmentation method. By integrating Gaussian noise, impulse noise, and strip noise models, our approach expands the noise distribution coverage of training data, thereby significantly enhancing the robustness of denoising models. Based on this framework, we construct a large-scale hybrid dataset and evaluate the performance of several representative deep learning models for aeromagnetic data denoising. Experimental results demonstrate that, compared to conventional single-noise training frameworks, the proposed method markedly improves model generalization capabilities. It achieves superior denoising performance in both single-noise and complex noise scenarios, offering a reliable solution for UAV aeromagnetic data processing in challenging real-world conditions. © 2025 Published by SPIE.","Aeromagnetic data denoising; composite noise modeling; data augmentation; deep learning; UAV geophysical exploration","Antennas; Background noise; Data reduction; Gaussian noise (electronic); Impulse noise; Large datasets; Learning systems; Unmanned aerial vehicles (UAV); Aerial vehicle; Aeromagnetic data; Aeromagnetic data denoising; Composite noise modeling; Data augmentation; Data de-noising; Deep learning; Geophysical exploration; Noise models; Unmanned aerial vehicle geophysical exploration; Deep learning","Conference paper","Final","","Scopus","2-s2.0-105022410175"
"Andersen R.E.; Zajaczkowski M.; Jaiswal H.; Xu J.; Fan W.; Boukas E.","Andersen, Rasmus Eckholdt (57206184543); Zajaczkowski, Marcin (57218601488); Jaiswal, Harsh (57844548600); Xu, Jianan (57843778900); Fan, Wenjie (57804329400); Boukas, Evangelos (51261053200)","57206184543; 57218601488; 57844548600; 57843778900; 57804329400; 51261053200","Depth-based Deep Learning for Manhole Detection in UAV Navigation","2022","IST 2022 - IEEE International Conference on Imaging Systems and Techniques, Proceedings","","","","","","11","10.1109/IST55454.2022.9827720","https://www.scopus.com/inward/record.uri?eid=2-s2.0-85135886040&doi=10.1109%2FIST55454.2022.9827720&partnerID=40&md5=ab7928cbe4c39598e872766043ca3da0","Drones navigating in dark, GPS-denied and confined spaces can pose a difficult challenge due to, among other, the processing power required to maintain a high resolution map of the environment. This is specifically challenging when the drone has to fly through narrow spaces where a low resolution voxel representation can result in failure to find viable trajectories. Drawing inspiration from the Inspectrone Project, which deals with the inspection of large marine vessels for classification processes, in this paper we propose using a deep learning model to detect manholes relying only on a depth image. We investigate different sizes of networks in an attempt to provide an adequate accuracy while maintain a low computational load, suitable for drone implementation on a parallel processing co-processor. With an end goal to be able to accurately and robustly traverse the ballast tanks of the aforementioned vessels, we employ a temporal filter to increase the robustness and limit sensitivity to false positives by requiring multiple detections within a timeframe before the final location of the manhole is confirmed to be valid. Our results show that using deep learning on depth images is a feasible way to achieve a scene texture-agnostic solution for the detection the manholes. Our approach is successfully demonstrated by flying through a 1: 1 size standard manhole found on marine vessel.  © 2022 IEEE.","Confined Spaces; Deep Learning; Manhole; UAV","Aircraft detection; Ballast (railroad track); Deep learning; Inspection; Textures; Confined space; Deep learning; Depth image; High resolution maps; Lower resolution; Manhole; Marine vessels; Narrow spaces; Processing power; Voxel representation; Drones","Conference paper","Final","","Scopus","2-s2.0-85135886040"
"Yan G.; Du J.; Chen S.; Tian X.","Yan, Guochuang (57296746800); Du, Jiang (60099049600); Chen, Song (60099483500); Tian, Xiaogeng (7202380035)","57296746800; 60099049600; 60099483500; 7202380035","Study on the Path Optimization Method of Autonomous Navigation of Uncrewed Aerial Vehicles Integrating Multi-Sensor Data","2025","IEEE Access","13","","","173016","173034","0","10.1109/ACCESS.2025.3609022","https://www.scopus.com/inward/record.uri?eid=2-s2.0-105015970428&doi=10.1109%2FACCESS.2025.3609022&partnerID=40&md5=d68e778f66eacd5c0e086c234414e213","AI-driven and sensor-fusion methods for autonomous systems, our work addresses the critical challenge of enhancing UAV path planning through multi-sensor integration. Prior approaches—such as traditional GNSS-inertial fusion or single-camera vision—suffer from limitations in GPS-denied or dynamic environments, often lacking robustness, adaptability, or real-time performance amid obstacles and sensor noise citeturn0search1turn1search3. We propose a novel optimization framework that deeply integrates data from multiple onboard sensors—including LiDAR, vision, and inertial units—within a deep reinforcement learning architecture informed by our method section. By leveraging sensor fusion, our method dynamically adjusts flight trajectories with heightened spatial awareness, improving obstacle avoidance and significantly reducing path deviations. Experimental results demonstrate that our approach outperforms baseline single-sensor and non-fused systems, achieving smoother, safer routes with lower cumulative error and real-time responsiveness. This integration highlights the advantages of multi-sensor fusion in UAV navigation, aligning strongly with the special issue’s theme of advanced data-driven autonomous flight. © 2013 IEEE.","deep reinforcement learning; Multi-sensor fusion; obstacle-aware trajectory planning; sensor-integrated autonomous; UAV path optimization","Air navigation; Antennas; Collision avoidance; Data integration; Deep learning; Deep reinforcement learning; Flight paths; Motion planning; Real time systems; Sensor data fusion; Autonomous navigation; Multi-sensor fusion; Obstacle-aware trajectory planning; Optimization method; Path optimizations; Reinforcement learnings; Sensor fusion; Sensor-integrated autonomous; Trajectory Planning; UAV path optimization; Unmanned aerial vehicles (UAV)","Article","Final","All Open Access; Gold Open Access; Green Open Access","Scopus","2-s2.0-105015970428"
"Saviolo A.; Li G.; Loianno G.","Saviolo, Alessandro (57222260042); Li, Guanrui (57207880149); Loianno, Giuseppe (55209864600)","57222260042; 57207880149; 55209864600","Physics-Inspired Temporal Learning of Quadrotor Dynamics for Accurate Model Predictive Trajectory Tracking","2022","IEEE Robotics and Automation Letters","7","4","","10256","10263","68","10.1109/LRA.2022.3192609","https://www.scopus.com/inward/record.uri?eid=2-s2.0-85135245495&doi=10.1109%2FLRA.2022.3192609&partnerID=40&md5=1e90b08ca98a9e5b146467fcf787cd25","Accurately modeling quadrotor's system dynamics is critical for guaranteeing agile, safe, and stable navigation. The model needs to capture the system behavior in multiple flight regimes and operating conditions, including those producing highly nonlinear effects such as aerodynamic forces and torques, rotor interactions, or possible system configuration modifications. Classical approaches rely on handcrafted models and struggle to generalize and scale to capture these effects. In this letter, we present a novel Physics-Inspired Temporal Convolutional Network (PI-TCN) approach to learning quadrotor's system dynamics purely from robot experience. Our approach combines the expressive power of sparse temporal convolutions and dense feed-forward connections to make accurate system predictions. In addition, physics constraints are embedded in the training process to facilitate the network's generalization capabilities to data outside the training distribution. Finally, we design a model predictive control approach that incorporates the learned dynamics for accurate closed-loop trajectory tracking fully exploiting the learned model predictions in a receding horizon fashion. Experimental results demonstrate that our approach accurately extracts the structure of the quadrotor's dynamics from data, capturing effects that would remain hidden to classical approaches. To the best of our knowledge, this is the first time physics-inspired deep learning is successfully applied to temporal convolutional networks and to the system identification task, while concurrently enabling predictive control.  © 2016 IEEE.","Aerial systems; model learning for control; optimization and optimal control; robot learning","Aerodynamics; Antennas; Convolution; Deep learning; Model predictive control; Predictive control systems; Robots; System theory; Aerial systems; Model learning; Model learning for control; Neural-networks; Optimization and optimal control; Predictive models; Quad rotors; S-systems; System Dynamics; Vehicle's dynamics; Neural networks","Article","Final","All Open Access; Green Open Access","Scopus","2-s2.0-85135245495"
"Ferretti D.; Spampinato L.; Testi E.; Buratti C.; Marini R.","Ferretti, Danila (57815255300); Spampinato, Leonardo (57949835200); Testi, Enrico (57215376431); Buratti, Chiara (24331062700); Marini, Riccardo (57221646066)","57815255300; 57949835200; 57215376431; 24331062700; 57221646066","Joint Trajectory Design and Radio Resource Management for Multi UAV-Aided Vehicular Networks","2025","IEEE International Conference on Communications","","","","2242","2247","0","10.1109/ICC52391.2025.11161060","https://www.scopus.com/inward/record.uri?eid=2-s2.0-105018465039&doi=10.1109%2FICC52391.2025.11161060&partnerID=40&md5=bf663a7e66befa90f26ac7cafe16ff20","In recent years, the integration of unmanned aerial vehicles (UAVs) into wireless networks has emerged as a promising solution to enhance coverage, optimize resourse allocation, and improve network performance in both uplink (UL) and downlink (DL) scenarios. This paper proposes a novel multi-agent deep reinforcement learning (MADRL) approach that combines UAV trajectory design with radio resource management (RRM). Our system adapts dynamically to user demands and network conditions, incorporating an interference management strategy and continuous service approach to enhance quality of experience (QoE) across multiple time instants. Experimental results demonstrate that our algorithm outperforms traditional placement strategies, achieving significant improvements in network performance, user satisfaction, and robustness under varying demand conditions. This work offers a practical solution for deploying UAVs in dense, real-world scenarios that require continuous and reliable connectivity.  © 2025 IEEE.","Multi-Agent Reinforcement Learning; Radio Resource Management; Trajectory Design; UAV; V2X Communications","Antennas; Deep learning; Energy efficiency; Intelligent agents; Mobile telecommunication systems; Multi agent systems; Natural resources management; Quality of service; Radio; Radio communication; Resource allocation; Trajectories; Aerial vehicle; Demand conditions; Design resources; Joint trajectories; Multi-agent reinforcement learning; Performance; Radio resources managements; Trajectory designs; Unmanned aerial vehicle; V2X communication; Unmanned aerial vehicles (UAV)","Conference paper","Final","","Scopus","2-s2.0-105018465039"
"Wang Y.; Perrusquia A.; Ignatyev D.","Wang, Yikang (59323461900); Perrusquia, Adolfo (57192589965); Ignatyev, Dmitry (56418371500)","59323461900; 57192589965; 56418371500","Towards Bio-Inspired Control of Aerial Vehicle: Distributed Aerodynamic Parameters for State Prediction","2024","Proceedings of Machine Learning Research","242","","","1096","1106","1","","https://www.scopus.com/inward/record.uri?eid=2-s2.0-85203681893&partnerID=40&md5=91136903ae53d70b9599717e59aa50c9","In an era where traditional flight control systems are increasingly strained by the demands of modern aerial missions, this research introduces a novel integration of bio-inspired sensing mechanisms into aerial vehicle control systems, aimed at revolutionizing the adaptability and efficiency of UAV operations. Current gust suppression technologies often activate only after disturbances have occurred, highlighting significant limitations in real-time responsiveness and computational efficiency. With a specific emphasis on employing distributed aerodynamic parameters for predicting flight states, the study utilizes a Convolutional Neural Network (CNN) and a Long Short-Term Memory (LSTM) network to investigate the predictive capabilities of these models under varying conditions, including scenarios with full and limited input data. The models were assessed on their ability to forecast the pitch rate of Unmanned Aerial Vehicles (UAVs), examining both the precision of predictions in response to different historical input sizes and their robustness against simulated sensor noise. Results highlight the potential of using aerodynamic data to enhance the reliability and adaptability of flight control systems, significantly reducing dependency on specific sensor inputs. This approach not only demonstrates the effectiveness of integrating sophisticated machine learning models with aerospace technology but also paves the way for more adaptive, efficient control systems in UAV operations. © 2024 Y. Wang, A. Perrusquia & D. Ignatyev.","Aerodynamic parameters; Aerospace engineering; Bio-inspired sensing; Convolutional Neural Networks; Flight state prediction; UAV","Adaptive control systems; Long short-term memory; Predictive control systems; Robustness (control systems); State estimation; Unmanned aerial vehicles (UAV); Aerial vehicle; Aerodynamic parameters; Bio-inspired sensing; Convolutional neural network; Flight state prediction; Flight-control systems; Sensing mechanism; State prediction; Unmanned aerial vehicle; Vehicle operations; Convolutional neural networks","Conference paper","Final","","Scopus","2-s2.0-85203681893"
"Zhao S.; Zhou F.; Wu Q.","Zhao, Shijin (57224974340); Zhou, Fuhui (56453758800); Wu, Qihui (60384055100)","57224974340; 56453758800; 60384055100","An Intelligent Multitarget AAV Coverage-Aware Navigation Method for Low-Altitude IoT","2025","IEEE Internet of Things Journal","12","8","","9557","9569","3","10.1109/JIOT.2025.3535164","https://www.scopus.com/inward/record.uri?eid=2-s2.0-105002580685&doi=10.1109%2FJIOT.2025.3535164&partnerID=40&md5=f304af3fe197a5f3a4075275bcf44b75","Cellular-connected autonomous aerial vehicles (AAVs) act as aerial users to accomplish navigation missions while maintaining a cellular connection, which are of great importance for developing low-altitude Internet of Things (IoT) systems. However, the full aerial cellular coverage is an extreme challenge. To tackle this issue, existing coverage-aware navigation studies focus on designing AAV flight trajectories to avoid weak coverage areas while completing the mission, where considerable efforts of deep-reinforcement-learning-(DRL)-based methods have been conducted. However, they lack adaptability to various targets, which limits their practical applicability in real-world scenarios. In this article, we propose a novel DRL-based multitarget coverage-aware navigation (MTCN) framework, where the AAV learns a navigation policy to minimize the weighted sum of navigation time and the expected communication outage duration. MTCN allows the AAV to efficiently navigate to arbitrary targets without the need of the separate policy training for each target. Furthermore, to improve the sample efficiency of the MTCN, we introduce the radio map-enhanced MTCN (RM-MTCN) framework, which leverages a virtual radio map to generate supplementary navigation training data. RM-MTCN can significantly reduce the need for extensive real-world interactions. Extensive experimental results demonstrate that both MTCN and RM-MTCN achieve generalized navigation behaviors across different targets while avoiding weak communication coverage areas. It is also shown that RM-MTCN exhibits faster learning speed and better performance compared to MTCN, which indicates the effectiveness of leveraging the virtual radio map during the policy training. © 2014 IEEE.","Cellular-connected autonomous aerial vehicles (AAVs); coverage-aware navigation; deep reinforcement learning (DRL); multitarget generalization; radio map","Aircraft communication; Aircraft exhibitions; Cellular radio systems; Deep learning; Deep reinforcement learning; Mobile antennas; Radio navigation; Reinforcement learning; Aerial vehicle; Cellular-connected unmanned aerial vehicle; Cellulars; Coverage aware; Coverage-aware navigation; Generalisation; Multi-target generalization; Multi-targets; Radio maps; Reinforcement learnings; Unmanned aerial vehicles (UAV)","Article","Final","","Scopus","2-s2.0-105002580685"
"Xie W.; Sun G.; Liu B.; Li J.; Wang J.; Du H.; Niyato D.; Kim D.I.","Xie, Wenwen (59095981600); Sun, Geng (56673281900); Liu, Bei (59309764500); Li, Jiahui (57216911722); Wang, Jiacheng (57201116237); Du, Hongyang (57211884589); Niyato, Dusit (8919714700); Kim, Dong In (35476060100)","59095981600; 56673281900; 59309764500; 57216911722; 57201116237; 57211884589; 8919714700; 35476060100","Joint Optimization of UAV-Carried IRS for Urban Low Altitude mmWave Communications With Deep Reinforcement Learning","2026","IEEE Transactions on Mobile Computing","25","1","","1381","1397","6","10.1109/TMC.2025.3600682","https://www.scopus.com/inward/record.uri?eid=2-s2.0-105014199066&doi=10.1109%2FTMC.2025.3600682&partnerID=40&md5=e8a4b0571a490ec16e0403eabe1650ca","Emerging technologies in sixth generation (6G) of wireless communications, such as terahertz communication and ultra-massive multiple-input multiple-output, present promising prospects. Despite the high data rate potential of millimeter wave communications, millimeter wave (mmWave) communications in urban low altitude economy (LAE) environments are constrained by challenges such as signal attenuation and multipath interference. Specially, in urban environments, mmWave communication experiences significant attenuation due to buildings, owing to its short wavelength, which necessitates developing innovative approaches to improve the robustness of such communications in LAE networking. In this paper, we explore the use of an uncrewed aerial vehicle (UAV)-carried intelligent reflecting surface (IRS) to support low altitude mmWave communication.Specifically, we consider a typical urban low altitude communication scenario where a UAV-carried IRS establishes a line-of-sight (LoS) channel between the mobile users and a source user (SU) despite the presence of obstacles. Subsequently, we formulate an optimization problem aimed at maximizing the transmission rates and minimizing the energy consumption of the UAV by jointly optimizing phase shifts of the IRS and UAV trajectory. Given the non-convex nature of the problem and its high dynamics, we propose a deep reinforcement learning-based approach incorporating neural episodic control, long short-term memory, and an IRS phase shift control method to enhance the stability and accelerate the convergence. Simulation results show that the proposed algorithm effectively resolves the problem and surpasses other benchmark algorithms in various performances. © 2002-2012 IEEE.","Deep reinforcement learning; intelligent reflecting surface; phase shift optimization; UAV","Aircraft control; Antennas; Benchmarking; Communication channels (information theory); Deep learning; Deep reinforcement learning; Energy utilization; Millimeter waves; Mobile telecommunication systems; Optimization; Urban planning; Aerial vehicle; Intelligent reflecting surface; Joint optimization; Low altitudes; Millimeterwave communications; Optimisations; Phase shift optimization; Reflecting surface; Reinforcement learnings; Unmanned aerial vehicle; Unmanned aerial vehicles (UAV)","Article","Final","","Scopus","2-s2.0-105014199066"
