"Authors","Author full names","Author(s) ID","Title","Year","Source title","Volume","Issue","Art. No.","Page start","Page end","Cited by","DOI","Link","Abstract","Author Keywords","Index Keywords","Document Type","Publication Stage","Open Access","Source","EID"
"Gao S.; Liu B.; Hui K.; Xu W.; Li J.; Zhao B.","Gao, Sihua (58099243400); Liu, Baoyu (59394311700); Hui, Kanghua (26424338100); Xu, Weifeng (36994834200); Li, Junhui (59394553900); Zhao, Bingyang (59394554000)","58099243400; 59394311700; 26424338100; 36994834200; 59394553900; 59394554000","Energy-Efficient UAV Trajectory Planning Algorithm for AoI-Constrained Data Collection; [信息年龄约束下的无人机数据采集能耗优化路径规划算法]","2024","Dianzi Yu Xinxi Xuebao/Journal of Electronics and Information Technology","46","10","","4024","4034","4","10.11999/JEIT240075","https://www.scopus.com/inward/record.uri?eid=2-s2.0-85208116181&doi=10.11999%2FJEIT240075&partnerID=40&md5=8021df9065be088c782dcd2dbecad52e","The information freshness is measured by Age of Information (AoI) of each sensor in Wireless Sensor Networks (WSN). The UAV optimizes flight trajectories and accelerates speed to assist WSN data collection, which guarantees that the data offloaded to the base station meets the AoI limitation of each sensor. However, the UAV’s inappropriate flight strategies cause non-essential energy consumption due to excessive flight distance and speed, which may result in the failure of data collection mission. In this paper, firstly a mathematical model is investigated and developed for the UAV energy consumption optimization trajectory planning problem on the basis of AoI-constrained data collection. Then, a novel deep reinforcement learning algorithm, named Cooperation Hybrid Proximal Policy Optimization (CH-PPO) algorithm, is proposed to simultaneously schedule the UAV’s access sequence, hovering position, the flight speed to the sensor nodes or the base station, to minimize the UAV's energy consumption under the constraint of data timeliness for each sensor node. Meanwhile, a loss function that integrates the discrete policy and continuous policy is designed to increase the rationality of hybrid actions and improve the training effectiveness of the proposed algorithm. Numerical results demonstrate that the CH-PPO algorithm outperforms the other three reinforcement learning algorithms in the comparison group in energy consumption of UAV and its influencing factors. Furthermore, the convergence, stability, and robustness of the proposed algorithm is well verified. © 2024 Science Press. All rights reserved.","AoI limitation; Cooperation hybrid proximal policy optimization algorithm; Deep reinforcement learning; Unmanned aerial vehicle trajectory planning; Wireless Sensor Networks (WSN)","Constrained optimization; Deep learning; Deep reinforcement learning; Flight paths; Rational functions; Reinforcement learning; Sensor nodes; Steganography; Unmanned aerial vehicles (UAV); Aerial vehicle; Age of information limitation; Cooperation hybrid proximal policy optimization algorithm; Optimization algorithms; Policy optimization; Reinforcement learnings; Sensors network; Trajectory Planning; Unmanned aerial vehicle trajectory planning; Vehicle trajectories; Wireless sensor; Wireless sensor network","Article","Final","","Scopus","2-s2.0-85208116181"
"Zhu B.; Bedeer E.; Nguyen H.H.; Barton R.; Henry J.","Zhu, Botao (57222338119); Bedeer, Ebrahim (24821451700); Nguyen, Ha H. (7403322108); Barton, Robert (57205427343); Henry, Jerome (57205425503)","57222338119; 24821451700; 7403322108; 57205427343; 57205425503","UAV Trajectory Planning in Wireless Sensor Networks for Energy Consumption Minimization by Deep Reinforcement Learning","2021","IEEE Transactions on Vehicular Technology","70","9","","9540","9554","209","10.1109/TVT.2021.3102161","https://www.scopus.com/inward/record.uri?eid=2-s2.0-85112670836&doi=10.1109%2FTVT.2021.3102161&partnerID=40&md5=37df4d49708a7891674102871b60531b","Unmanned aerial vehicles (UAVs) have emerged as a promising candidate solution for data collection of large-scale wireless sensor networks (WSNs). In this paper, we investigate a UAV-aided WSN, where cluster heads (CHs) receive data from their member nodes, and a UAV is dispatched to collect data from CHs. We aim to minimize the total energy consumption of the UAV-WSN system in a complete round of data collection. Toward this end, we formulate the energy consumption minimization problem as a constrained combinatorial optimization problem by jointly selecting CHs from clusters and planning the UAV's visiting order to the selected CHs. The formulated energy consumption minimization problem is NP-hard, and hence, hard to solve optimally. To tackle this challenge, we propose a novel deep reinforcement learning (DRL) technique, pointer network-A∗ (Ptr-A∗), which can efficiently learn the UAV trajectory policy for minimizing the energy consumption. The UAV's start point and the WSN with a set of pre-determined clusters are fed into the Ptr-A∗, and the Ptr-A∗ outputs a group of CHs and the visiting order of CHs, i.e., the UAV's trajectory. The parameters of the Ptr-A∗ are trained on small-scale clusters problem instances for faster training by using the actor-critic algorithm in an unsupervised manner. Simulation results show that the trained models based on 20-clusters and 40-clusters have a good generalization ability to solve the UAV's trajectory planning problem in WSNs with different numbers of clusters, without retraining the models. Furthermore, the results show that our proposed DRL algorithm outperforms two baseline techniques. © 1967-2012 IEEE.","Combinatorial optimization; deep reinforcement learning; trajectory planning; UAV; WSN","Antennas; Combinatorial optimization; Constrained optimization; Data acquisition; Energy policy; Energy utilization; NP-hard; Reinforcement learning; Sensor nodes; Trajectories; Unmanned aerial vehicles (UAV); Actor-critic algorithm; Constrained combinatorial optimization; Energy Consumption Minimization; Generalization ability; Large-scale wireless sensor networks; Quality of solution; Small-scale clusters; Total energy consumption; Deep learning","Article","Final","","Scopus","2-s2.0-85112670836"
"Xia Y.; Ding T.; Wang X.; Tong Z.; Liu T.; Xiong Q.; Xu X.","Xia, Yi (58181171700); Ding, Tianyun (58900691100); Wang, Xianghe (57382285400); Tong, Ziheng (58609231500); Liu, Tenglong (59180779900); Xiong, Quan (57203879417); Xu, Xin (57071888700)","58181171700; 58900691100; 57382285400; 58609231500; 59180779900; 57203879417; 57071888700","DRL-Empowered Topology Control for Time-Critical UAV Swarm Networks in Low-Altitude Economy","2026","IEEE Transactions on Cognitive Communications and Networking","12","","","3661","3673","0","10.1109/TCCN.2025.3631065","https://www.scopus.com/inward/record.uri?eid=2-s2.0-105021661015&doi=10.1109%2FTCCN.2025.3631065&partnerID=40&md5=af4d32dd0a1419c83ba4b7188a8655b4","Fueled by the widespread deployment of uncrewed aerial vehicles (UAVs), the low-altitude economy (LAE) is experiencing a period of rapid growth, marking the entry of industry and commerce into a brand-new era. Although UAVs can effectively collaborate to accomplish LAE missions, the design of UAV networks presents numerous challenges, including high agility requirements, dynamically varying communication environments, and stringent time constraints. Therefore, to address these challenges, this paper proposes a deep reinforcement learning (DRL)-based topology control approach for UAV swarms operating under prescribed time constraints, ensuring reliable formation tracking despite dynamic communication conditions and temporal limitations. Specifically, to enhance the robustness of UAV networks against unpredictable communication losses due to sensor faults, a DRL-based topology decision-making algorithm is developed. This enables the topology structure to be dynamically adjusted in response to intermittent communication link failures among UAVs over specific time intervals. Furthermore, a novel prescribed-time UAV formation controller is designed to propel networked UAVs to reach the desired trajectory within a specified convergence time. Simulation results demonstrate that the proposed method is effective and outperforms the baseline schemes.  © 2015 IEEE.","deep reinforcement learning; formation control; switching communication topologies; time constraints; UAV","Aircraft control; Aircraft detection; Altitude control; Antennas; Decision making; Deep learning; Distributed computer systems; Industrial economics; Network topology; Robotics; Sensor networks; Telecommunication links; Communication topologies; Formation control; Low altitudes; Reinforcement learnings; Switching communication topology; Time constraints; Time-critical; Topology control; Uncrewed aerial vehicles; Vehicle network; Unmanned aerial vehicles (UAV)","Article","Final","","Scopus","2-s2.0-105021661015"
"Dwiputro D.W.; Hendrawan","Dwiputro, Daniel Wiyogo (60450005400); Hendrawan (60154236600)","60450005400; 60154236600","Machine Learning Approach for Integrated Sensing and Communication in 6G Radio Standard: A Systematic Literature Review","2025","Proceeding of 2025 19th International Conference on Telecommunication Systems, Services, and Applications, TSSA 2025","","","","","","0","10.1109/TSSA68467.2025.11303781","https://www.scopus.com/inward/record.uri?eid=2-s2.0-105032189038&doi=10.1109%2FTSSA68467.2025.11303781&partnerID=40&md5=ed09ff57caee53cafb7a0f5f09a08814","Integrated Sensing and Communication (ISAC), also known as Joint Communication and Sensing (JCAS), is a cornerstone technology for 5G-Advanced and 6G networks, enabling environmental perception alongside data transmission. Machine Learning (ML) is increasingly pivotal in realizing the full potential of ISAC. This systematic literature review analyzes the current state of research on ML applications within ISAC for 6G wireless systems. Our analysis reveals a vibrant research landscape focusing on leveraging ML, particularly Deep Learning (DL) and Reinforcement Learning (RL), for diverse ISAC functions including beamforming, localization, resource allocation, and enhancing security. While significant benefits such as improved performance, accuracy, and efficiency are reported, key challenges remain, notably concerning security, privacy, real-time processing latency, computational complexity, and robustness. Emerging trends highlight the integration of ML-driven ISAC with technologies like Reconfigurable Intelligent Surfaces (RIS), Unmanned Aerial Vehicles (UAVs), Terahertz (THz) communications, Edge Al, and Digital Twins. Furthermore, ML is shown to be instrumental in enabling advanced 6G applications, including autonomous driving, extended reality (XR), satellite communications, and environmental sensing. This review synthesizes the advancements, identifies persistent challenges, and outlines future research trajectories for ML in the evolving field of ISAC.  © 2025 IEEE.","5G; 6G; Integrated Sensing and Communication; ISAC; Machine Learning; ML","Antennas; Deep learning; Deep reinforcement learning; Digital twin; Radio communication; Reinforcement learning; Reviews; Satellite communication systems; Unmanned aerial vehicles (UAV); 5g; 6g; Integrated sensing; Integrated sensing and communication; Machine learning approaches; Machine-learning; Systematic literature review; Learning systems","Conference paper","Final","","Scopus","2-s2.0-105032189038"
"Ning Z.; Yang Y.; Wang X.; Song Q.; Guo L.; Jamalipour A.","Ning, Zhaolong (36069914200); Yang, Yuxuan (58185037600); Wang, Xiaojie (54881224300); Song, Qingyang (8852647200); Guo, Lei (57208156960); Jamalipour, Abbas (7003564684)","36069914200; 58185037600; 54881224300; 8852647200; 57208156960; 7003564684","Multi-Agent Deep Reinforcement Learning Based UAV Trajectory Optimization for Differentiated Services","2024","IEEE Transactions on Mobile Computing","23","5","","5818","5834","89","10.1109/TMC.2023.3312276","https://www.scopus.com/inward/record.uri?eid=2-s2.0-85171532752&doi=10.1109%2FTMC.2023.3312276&partnerID=40&md5=0f5670057075ccd3c7a05390d6d47e0d","Driven by the increasing computational demand of real-time mobile applications, Unmanned Aerial Vehicle (UAV) assisted Multi-access Edge Computing (MEC) has been envisioned as a promising paradigm for pushing computational resources to network edges and constructing high-throughput line-of-sight links for ground users. Most exsiting studies consider simplified scenarios, such as a single UAV, Service Provider (SP) or service type, and centralized UAV trajectory control. In order to be more in line with real-world cases, we intend to achieve distributed trajectory control of multiple UAVs in UAV-assisted MEC networks with multiple SPs providing differentiated services. Our objective is to minimize the short-term computational costs of ground users and the long-term computational cost of UAVs, simultaneously based on incomplete information. We first solve the formulated problem by reaching the Nash Equilibrium (NE) of the game among SPs based on complete information. We further formulate a Markov game model and propose a Deep Reinforcement Learning (DRL)-based UAV trajectory optimization algorithm, where only local observations of each UAV are required for each SP's flying action execution. Theoretical analysis and performance evaluation demonstrate the convergence, efficiency, scalability, and robustness of our algorithm compared with other representative algorithms. © 2002-2012 IEEE.","game theory; Multi-access edge computing; multi-agent DRL; UAV-assisted communications","Antennas; Computation theory; Computational efficiency; Cost benefit analysis; Deep learning; Edge computing; Game theory; Multi agent systems; Trajectories; Unmanned aerial vehicles (UAV); Aerial vehicle; Edge computing; Multi agent; Multi-access edge computing; Multi-agent deep reinforcement learning; Multiaccess; Reinforcement learnings; Resource management; Task analysis; Trajectory optimization; Unmanned aerial vehicle-assisted communication; Reinforcement learning","Article","Final","","Scopus","2-s2.0-85171532752"
"Chen W.; Xue Y.","Chen, Weisheng (55650681800); Xue, Yuntao (57958496200)","55650681800; 57958496200","Hierarchical UAV Autonomous Navigation Algorithm Based on Event-Triggered Deep Reinforcement Learning","2025","IEEE Transactions on Vehicular Technology","74","12","","18433","18444","2","10.1109/TVT.2025.3584964","https://www.scopus.com/inward/record.uri?eid=2-s2.0-105009995176&doi=10.1109%2FTVT.2025.3584964&partnerID=40&md5=b571bbd8b354e81cd5efbeaee0884459","In unknown environments, achieving autonomous navigation for uncrewed aerial vehicles (UAVs) is a complex task. Ensuring that UAVs reach their destinations safely and efficiently remains a critical challenge. When obstacles are densely distributed, conventional motion planning algorithms often face difficulties in finding viable solutions due to increased problem complexity. Deep reinforcement learning (DRL)-based navigation strategies are known for their generalization capabilities and robustness. However, the trajectories generated through end-to-end reinforcement learning (RL) approaches tend to lack smoothness and may not align with the UAVs' dynamic feasibility requirements. This study proposes a hierarchical navigation framework by combining event-triggered deep reinforcement learning with traditional motion planning techniques. In the proposed framework, the DRL module receives raw sensor input to generate local goals, while the lower-level classical planner ensures that the paths leading to these goals are smooth and collision-free. The event-triggered Recurrent Soft Value Gradient (RSVG) algorithm activates goal generation only when obstacles are detected, optimizing computational efficiency and improving real-time decision-making. Extensive experiments are conducted in simulated environments with randomly placed static obstacles to validate the effectiveness of the proposed framework. © 1967-2012 IEEE.","deep reinforcement learning; event-triggered; Hierarchical UAV navigation; motion planning; partially observable Markov decision process","Air navigation; Antennas; Behavioral research; Computational complexity; Computational efficiency; Decision making; Deep learning; Deep reinforcement learning; Learning algorithms; Markov processes; Time and motion study; Unmanned aerial vehicles (UAV); Aerial vehicle; Event-triggered; Hierarchical unmanned aerial vehicle navigation; Motion-planning; Navigation algorithms; Partially observable Markov decision process; Reinforcement learnings; Unknown environments; Vehicle autonomous navigations; Vehicle navigation; Motion planning","Article","Final","","Scopus","2-s2.0-105009995176"
"Gao Y.; Yuan X.; Yang D.; Hu Y.; Cao Y.; Schmeink A.","Gao, Yunfei (58603372800); Yuan, Xiaopeng (57211659345); Yang, Dingcheng (37092545600); Hu, Yulin (57913942400); Cao, Yue (55470310200); Schmeink, Anke (55663459400)","58603372800; 57211659345; 37092545600; 57913942400; 55470310200; 55663459400","UAV-Assisted MEC System With Mobile Ground Terminals: DRL-Based Joint Terminal Scheduling and UAV 3D Trajectory Design","2024","IEEE Transactions on Vehicular Technology","73","7","","10164","10180","68","10.1109/TVT.2024.3367624","https://www.scopus.com/inward/record.uri?eid=2-s2.0-85189331309&doi=10.1109%2FTVT.2024.3367624&partnerID=40&md5=ab9085f697bf194fb65ba03fd935e23c","In this paper, we investigate an unmanned aerial vehicle (UAV)-assisted edge computing network in a sophisticated three-dimensional (3D) scenario, e.g., a post-disaster urban area with multiple mobile ground terminals (GTs) for resilience. The mission of the UAV is to first collect a set of computation tasks from multiple GT sources, then process them and make joint decisions (computation results) which are finally transmitted to another set of GT destinations. An efficient design is provided aiming at minimizing the total time cost including costs for the task offloading, computations, and decision transmissions, via jointly designing the UAV's trajectory and the scheduling of communications from and to different GTs. In particular, we take into account the practical assumptions on the GTs' mobility, on the obstacle avoidance to 3D buildings, and on that the UAV is possible to fly among buildings, i.e., the flying altitude can be lower than the buildings' heights. To address the established complex and non-convex problem, we first provide a problem transformation by exploiting Markov decision process (MDP), and then propose a deep reinforcement learning (DRL) approach-based solution with a multi-step dueling DDQN (D3QN) method. As a result, an efficient solution is achieved, where the UAV acts as the agent to continuously explore and improve its mobile strategy during interacting with the environment under the proposed method. The simulation results show the advantages of the proposed 3D trajectory design in comparison to a 2D one. In addition, the results confirm the robustness of the proposed design in terms of different GTs' mobility models and UAV flying height/area limits, and illustrate the superiority of unrestricted feasible domains for the UAV flight.  © 1967-2012 IEEE.","3D trajectory design; deep reinforcement learning; obstacle avoidance; probabilistic LoS channel; UAV","Antennas; Deep learning; Drones; Job analysis; Markov processes; Motion planning; Probabilistic logics; Three dimensional displays; Trajectories; 3-D trajectory; 3d trajectory design; Aerial vehicle; Collisions avoidance; Deep reinforcement learning; Obstacles avoidance; Probabilistic LoS channel; Probabilistics; Reinforcement learnings; Task analysis; Three-dimensional display; Trajectory designs; Unmanned aerial vehicle; Reinforcement learning","Article","Final","","Scopus","2-s2.0-85189331309"
"Arsalan A.; Umer T.; Rehman R.A.; Abdelmoniem A.M.; Mumtaz S.","Arsalan, Ahmad (57207295792); Umer, Tariq (56030537100); Rehman, Rana Asif (55546866100); Abdelmoniem, Ahmed M. (57172929800); Mumtaz, Shahid (24776675300)","57207295792; 56030537100; 55546866100; 57172929800; 24776675300","Toward Collaborative Intelligence in Digital Twin-based Federated Deep Reinforcement Learning: Applications, Case Studies and Challenges","2025","IEEE Network","","","","","","2","10.1109/MNET.2025.3592547","https://www.scopus.com/inward/record.uri?eid=2-s2.0-105012264262&doi=10.1109%2FMNET.2025.3592547&partnerID=40&md5=835001e6caba2a7387a4536b18f9be1d","Unmanned Aerial Vehicles (UAVs) combined with the Internet of Things (IoT) provide dynamic, comprehensive, and crucial applications. Nonetheless, real-time decision-making in these networks faces energy constraints, environmental instabilities, and issues in decentralized resource management. Conventional Reinforcement Learning (RL) techniques lack safety considerations and generalization across varied situations, whereas centralized learning faces communication overhead and raises privacy issues. To mitigate these constraints, this paper introduces a Digital Twin-based Federated Deep Reinforcement Learning (DT-FDRL) architecture for collaborative UAV-IoT networks. DT-FDRL empowers agents to simulate task outcomes who cooperate effectively without exchanging raw data. We present the system through various UAV applications, including trajectory optimization, swarm coordination, and policy adaptation. Experimental findings demonstrate superior energy efficiency, increased safety in exploration, and enhanced rewards collection. Furthermore, we outline challenges and prospective research opportunities for scalable, secure, intelligent UAV-IoT implementations. © IEEE. 1986-2012 IEEE.","Digital Twin; Federated Learning; Resource Management; UAV","Antennas; Collaborative learning; Data privacy; Decision making; Digital twin; Distributed computer systems; Energy efficiency; Federated learning; Internet of things; Machine learning; Natural resources management; Network security; Resource allocation; Aerial vehicle; Case-studies; Energy constraint; Environmental instability; Environmental issues; Real time decision-making; Real-time decision making; Reinforcement learnings; Resource management; Unmanned aerial vehicle; Unmanned aerial vehicles (UAV)","Article","Article in press","","Scopus","2-s2.0-105012264262"
"Kaufmann E.; Loquercio A.; Ranftl R.; Dosovitskiy A.; Koltun V.; Scaramuzza D.","Kaufmann, Elia (57200625254); Loquercio, Antonio (57195424419); Ranftl, Rene (55336377000); Dosovitskiy, Alexey (56582202400); Koltun, Vladlen (7004337914); Scaramuzza, Davide (16550950000)","57200625254; 57195424419; 55336377000; 56582202400; 7004337914; 16550950000","Deep Drone Racing: Learning Agile Flight in Dynamic Environments","2018","Proceedings of Machine Learning Research","87","","","133","145","74","","https://www.scopus.com/inward/record.uri?eid=2-s2.0-85160353983&partnerID=40&md5=2313e0979c7cb65851188f0cfb5e37f4","Autonomous agile flight brings up fundamental challenges in robotics, such as coping with unreliable state estimation, reacting optimally to dynamically changing environments, and coupling perception and action in real time under severe resource constraints. In this paper, we consider these challenges in the context of autonomous, vision-based drone racing in dynamic environments. Our approach combines a convolutional neural network (CNN) with a state-of-the-art path-planning and control system. The CNN directly maps raw images into a robust representation in the form of a waypoint and desired speed. This information is then used by the planner to generate a short, minimum-jerk trajectory segment and corresponding motor commands to reach the desired goal. We demonstrate our method in autonomous agile flight scenarios, in which a vision-based quadrotor traverses drone-racing tracks with possibly moving gates. Our method does not require any explicit map of the environment and runs fully onboard. We extensively test the precision and robustness of the approach in simulation and in the physical world. We also evaluate our method against state-of-the-art navigation approaches and professional human drone pilots. © CoRL 2018. All rights reserved.","Drone Racing; Learning Agile Flight; Learning for Control","Air navigation; Drones; Flight control systems; Motion planning; Neural networks; Robots; Visual servoing; Changing environment; Convolutional neural network; Drone racing; Dynamic environments; Learning agile flight; Learning for control; Perception and actions; Real- time; State of the art; Vision based; Deep learning","Conference paper","Final","","Scopus","2-s2.0-85160353983"
