"Authors","Author full names","Author(s) ID","Title","Year","Source title","Volume","Issue","Art. No.","Page start","Page end","Cited by","DOI","Link","Abstract","Author Keywords","Index Keywords","Document Type","Publication Stage","Open Access","Source","EID"
"Souissi A.; Fradi H.; Papadakis P.","Souissi, Ala (59409873300); Fradi, Hajer (37072021100); Papadakis, Panagiotis (36960841900)","59409873300; 37072021100; 36960841900","Towards Event-Driven, End-to-End UAV Tracking Using Deep Reinforcement Learning","2025","UAVM 2025 - Proceedings of the 3rd International Workshop on UAVs in Multimedia: Capturing the World from a New Perspective, Co-located with MM 2025","","","","52","56","0","10.1145/3728482.3757384","https://www.scopus.com/inward/record.uri?eid=2-s2.0-105023087324&doi=10.1145%2F3728482.3757384&partnerID=40&md5=ea9e0a8a0d0941188bcfad0444cf27ae","To enable autonomous active tracking by a drone in applications where RGB cameras would be insufficient, in this paper, we propose an event-based pipeline exhibiting enhanced robustness and performance in adverse and highly dynamic conditions. In particular, we design a event data-driven controller trained end-to-end via deep reinforcement learning to respond to raw event streams to follow a target/leader drone. To favor policy generalization across diverse conditions, the agent is exposed during training to intensive domain randomization in terms of scene layout, as well as target trajectory shape and dynamics. Experiments are performed in simulation in a framework reminiscent of search and rescue scenarios by training and testing in simulated DARPA subterranean challenge environments, showing superior performance compared to conventional RGB-based tracking under high-speed and low-lighting. Related source-code is available at: https://github.com/AlaSouissi5/DRLDrone-Tracking. © 2025 owner/author(s)","Deep Reinforcement Learning; Event cameras; tracking; UAV","Cameras; Data streams; Deep learning; Deep reinforcement learning; Target drones; Tracking (position); Active tracking; Dynamic condition; End to end; Event camera; Event-based; Event-driven; Performance; Reinforcement learnings; RGB cameras; Tracking; Drones","Conference paper","Final","All Open Access; Gold Open Access; Green Open Access","Scopus","2-s2.0-105023087324"
"Wu H.; wang M.; Wang J.; wang G.","Wu, Hongzhi (58929386400); wang, Miao (14039685500); Wang, Jingshi (57752334100); wang, Guoqing (56205542800)","58929386400; 14039685500; 57752334100; 56205542800","Distributed information fusion based trajectory tracking for USV and UAV clusters via multi-agent deep learning approach","2024","Aerospace Systems","7","2","","193","207","4","10.1007/s42401-024-00275-4","https://www.scopus.com/inward/record.uri?eid=2-s2.0-85187250988&doi=10.1007%2Fs42401-024-00275-4&partnerID=40&md5=5c94d3eba022ecaebb9b096784d74778","Considering the complexities of the modern maritime operational environment and aiming for effective safe navigation and communication maintenance, research into the collaborative trajectory tracking problem of unmanned surface vehicles (USVs) and unmanned aerial vehicles (UAVs) clusters during patrol and target tracking missions holds paramount significance. This paper proposes a multi-agent deep reinforcement learning (MADRL) approach, specifically the action-constrained multi-agent deep deterministic policy gradient (MADDPG), to efficiently solve the collaborative maritime-aerial distributed information fusion-based trajectory tracking problem. The proposed approach incorporates a constraint model based on the characteristics of maritime-aerial distributed information fusion mode and two designed reward functions—one global for target tracking and one local for cross-domain collaborative unmanned clusters. Simulation experiments under three different mission scenarios have been conducted, and results demonstrate that the proposed approach possesses excellent applicability to trajectory tracking tasks in collaborative maritime-aerial settings, exhibiting strong convergence and robustness in mobile target tracking. In a complex three-dimensional simulation environment, the improved algorithm demonstrated an 11.04% reduction in training time for convergence and an 8.03% increase in reward values compared to the original algorithm. This indicates that the introduction of attention mechanisms and the design of reward functions enable the algorithm to learn optimal strategies more quickly and effectively. © Shanghai Jiao Tong University 2024.","Distributed information fusion; MADRL; Maritime-aerial collaboration; UAVs; Unmanned cluster; USVs","Air navigation; Aircraft detection; Antennas; Clutter (information theory); Deep learning; Information fusion; Military vehicles; Multi agent systems; Trajectories; Unmanned aerial vehicles (UAV); Unmanned surface vehicles; Vehicle to vehicle communications; Aerial vehicle; Distributed information fusion; Maritime-aerial collaboration; Multi agent; Multi-agent deep reinforcement learning; Reinforcement learnings; Targets tracking; Trajectory-tracking; Unmanned aerial vehicle; Unmanned cluster; Reinforcement learning","Review","Final","","Scopus","2-s2.0-85187250988"
"Do T.-D.; Xuan-Mung N.; Sung C.; Lee J.Y.; Lee Y.-S.; Hong S.K.","Do, Truong-Dong (57205759543); Xuan-Mung, Nguyen (57209105455); Sung, Changwoo (58611451800); Lee, Jun Yong (57217088932); Lee, Yong-Seok (58072182800); Hong, Sung Kyung (7405767196)","57205759543; 57209105455; 58611451800; 57217088932; 58072182800; 7405767196","Robust Deep Reinforcement Learning-based Quadcopter Controller: Sim2Real Approach and Experiments with External Disturbances","2024","15th Asia-Pacific International Symposium on Aerospace Technology, APISAT 2024","3","","","1810","1819","0","","https://www.scopus.com/inward/record.uri?eid=2-s2.0-105015035791&partnerID=40&md5=d40f6deba22f8f03ec07105c026f0931","Quadcopters have been widely studied for decades due to their maneuverability and ability to operate in various circumstances. Maintaining the stability of quadcopters is extremely challenging due to the highly nonlinear dynamics of quadcopters, as well as constraints in actuation and the presence of sensor noise. Designing efficient controllers that correspond to certain platforms often requires the manual tuning of heuristic parameters, extensive understanding of the system, or long design times. Conventional strategies depend on accurate, complicated, and challenging-to-obtain models of the vehicle and the surrounding environment. Deep reinforcement learning (DRL) is a promising approach in the control of autonomous multirotor aerial vehicles, with recent advancements in deployment, performance enhancement, and generalization. In this paper, a deep reinforcement learning-based controller for quadcopters is proposed that is secure for real-world implementation, data-efficient, and free of human gain adjustments. First, a novel actor-critic-based architecture is designed to map the robot states directly to the motor outputs. Then, a simulator was created using quadcopter dynamics to facilitate the training of the controller policy in presence of the sensor noise and external disturbances. Finally, the trained control policy is deployed on a real Crazyflie 2.1 quadrotor platform without any fine-tuning to track a trajectory in real-world wind turbulences. According to the experimental results, the approach proved both robust to external disturbance along with effectiveness and feasibility for bridging the simulation-to-reality gap. © 2024 15th Asia-Pacific International Symposium on Aerospace Technology, APISAT 2024. All rights reserved.","actor-critic network; deep reinforcement learning; external disturbance; quadcopter controller; sim2real","Aircraft control; Antennas; Deep learning; Deep reinforcement learning; Learning algorithms; Reinforcement learning; Simulation platform; Tuning; Actor critic; Actor-critic network; Critic network; External disturbances; Manoeuvrability; Manual tuning; Quadcopter controller; Reinforcement learnings; Sensors noise; Sim2real; Controllers","Conference paper","Final","","Scopus","2-s2.0-105015035791"
"Tse K.-W.; Pi R.; Sun Y.; Wen C.-Y.; Feng Y.","Tse, Kwai-Wa (57222020935); Pi, Rendong (57217172415); Sun, Yuxiang (56434669900); Wen, Chih-Yung (7201366945); Feng, Yurong (57222029146)","57222020935; 57217172415; 56434669900; 7201366945; 57222029146","A Novel Real-Time Autonomous Crack Inspection System Based on Unmanned Aerial Vehicles","2023","Sensors","23","7","3418","","","17","10.3390/s23073418","https://www.scopus.com/inward/record.uri?eid=2-s2.0-85152327726&doi=10.3390%2Fs23073418&partnerID=40&md5=2fc2a6ae1e603394b9e8001b76a66874","Traditional methods on crack inspection for large infrastructures require a number of structural health inspection devices and instruments. They usually use the signal changes caused by physical deformations from cracks to detect the cracks, which is time-consuming and cost-ineffective. In this work, we propose a novel real-time crack inspection system based on unmanned aerial vehicles for real-world applications. The proposed system successfully detects and classifies various types of cracks. It can accurately find the crack positions in the world coordinate system. Our detector is based on an improved YOLOv4 with an attention module, which produces 90.02% mean average precision (mAP) and outperforms the YOLOv4-original by 5.23% in terms of mAP. The proposed system is low-cost and lightweight. Moreover, it is not restricted by navigation trajectories. The experimental results demonstrate the robustness and effectiveness of our system in real-world crack inspection tasks. © 2023 by the authors.","attention module; autonomous inspection; crack detection; crack localization; deep learning; UAS; unmanned aerial vehicles; YOLOv4","Aircraft detection; Antennas; Deep learning; Structural health monitoring; Unmanned aerial vehicles (UAV); Aerial vehicle; Attention module; Autonomous inspection; Crack inspection; Crack localization; Deep learning; Real- time; UAS; Unmanned aerial vehicle; YOLOv4; article; attention; deep learning; unmanned aerial vehicle; Crack detection","Article","Final","All Open Access; Gold Open Access; Green Open Access","Scopus","2-s2.0-85152327726"
"Li B.; Yang R.; Liu L.; Wang J.; Zhang N.; Dong M.","Li, Bin (57226853676); Yang, Rongrong (58523735700); Liu, Lei (56612510500); Wang, Junyi (57206680595); Zhang, Ning (56575788300); Dong, Mianxiong (25822274100)","57226853676; 58523735700; 56612510500; 57206680595; 56575788300; 25822274100","Robust Computation Offloading and Trajectory Optimization for Multi-UAV-Assisted MEC: A Multiagent DRL Approach","2024","IEEE Internet of Things Journal","11","3","","4775","4786","77","10.1109/JIOT.2023.3300718","https://www.scopus.com/inward/record.uri?eid=2-s2.0-85166777090&doi=10.1109%2FJIOT.2023.3300718&partnerID=40&md5=5c76dbae3bd2adec0179cb738d1efde7","For multiple unmanned-aerial-vehicles (UAVs)-assisted mobile-edge computing (MEC) networks, we study the problem of combined computation and communication for user equipments deployed with multitype tasks. Specifically, we consider that the MEC network encompasses both communication and computation uncertainties, where the partial channel state information and the inaccurate estimation of task complexity are only available. We introduce a robust design accounting for these uncertainties and minimize the total weighted energy consumption by jointly optimizing UAV trajectory, task partition, as well as the computation and communication resource allocation in the multi-UAV scenario. The formulated problem is challenging to solve with the coupled optimization variables and the high uncertainties. To overcome this issue, we reformulate a multiagent Markov decision process and propose a multiagent proximal policy optimization with Beta distribution framework to achieve a flexible learning policy. Numerical results demonstrate the effectiveness and robustness of the proposed algorithm for the multi-UAV-assisted MEC network, which outperforms the representative benchmarks of the deep reinforcement learning and heuristic algorithms.  © 2014 IEEE.","Communication uncertainty; computation uncertainty; mobile-edge computing (MEC); multiagent deep reinforcement learning (MADRL); robust design","Antennas; Computation offloading; Deep learning; Energy utilization; Heuristic algorithms; Job analysis; Markov processes; Mobile edge computing; Motion planning; Multi agent systems; Optimization; Trajectories; Uncertainty analysis; Unmanned aerial vehicles (UAV); Communication uncertainty; Computation uncertainty; Energy-consumption; Multi agent; Multi-agent deep reinforcement learning; Reinforcement learnings; Robust designs; Robustness; Task analysis; Uncertainty; Reinforcement learning","Article","Final","All Open Access; Green Open Access","Scopus","2-s2.0-85166777090"
"Lei T.; Luo C.; Jan G.E.; Bi Z.","Lei, Tingjun (57211431500); Luo, Chaomin (7402443332); Jan, Gene Eu (7006942845); Bi, Zhuming (7102348549)","57211431500; 7402443332; 7006942845; 7102348549","Deep Learning-Based Complete Coverage Path Planning With Re-Joint and Obstacle Fusion Paradigm","2022","Frontiers in Robotics and AI","9","","843816","","","42","10.3389/frobt.2022.843816","https://www.scopus.com/inward/record.uri?eid=2-s2.0-85128467714&doi=10.3389%2Ffrobt.2022.843816&partnerID=40&md5=db88ccec8cb137ffce3608217a82d2f3","With the introduction of autonomy into the precision agriculture process, environmental exploration, disaster response, and other fields, one of the global demands is to navigate autonomous vehicles to completely cover entire unknown environments. In the previous complete coverage path planning (CCPP) research, however, autonomous vehicles need to consider mapping, obstacle avoidance, and route planning simultaneously during operating in the workspace, which results in an extremely complicated and computationally expensive navigation system. In this study, a new framework is developed in light of a hierarchical manner with the obtained environmental information and gradually solving navigation problems layer by layer, consisting of environmental mapping, path generation, CCPP, and dynamic obstacle avoidance. The first layer based on satellite images utilizes a deep learning method to generate the CCPP trajectory through the position of the autonomous vehicle. In the second layer, an obstacle fusion paradigm in the map is developed based on the unmanned aerial vehicle (UAV) onboard sensors. A nature-inspired algorithm is adopted for obstacle avoidance and CCPP re-joint. Equipped with the onboard LIDAR equipment, autonomous vehicles, in the third layer, dynamically avoid moving obstacles. Simulated experiments validate the effectiveness and robustness of the proposed framework. Copyright © 2022 Lei, Luo, Jan and Bi.","complete coverage path planning; Deep learning-based path generation; nature-inspired path planning; obstacle approximation and fusion; re-joint paradigm; velocity-based local navigator","","Article","Final","All Open Access; Gold Open Access; Green Open Access","Scopus","2-s2.0-85128467714"
"Pang T.; Xiao W.; Liu Y.; Wang T.; Liu J.; Gao M.","Pang, Tao (55371724400); Xiao, Wenwen (57751730000); Liu, Yilin (59106262600); Wang, Tao (59045520400); Liu, Jie (59061827000); Gao, Mingke (56814140600)","55371724400; 57751730000; 59106262600; 59045520400; 59061827000; 56814140600","Web-enhanced unmanned aerial vehicle target search method combining imitation learning and reinforcement learning","2024","International Journal of Web Information Systems","20","3","","324","337","1","10.1108/IJWIS-10-2023-0186","https://www.scopus.com/inward/record.uri?eid=2-s2.0-85188835488&doi=10.1108%2FIJWIS-10-2023-0186&partnerID=40&md5=7a552b54e41c5a9a2825c0d435e43e52","Purpose: This paper aims to study the agent learning from expert demonstration data while incorporating reinforcement learning (RL), which enables the agent to break through the limitations of expert demonstration data and reduces the dimensionality of the agent’s exploration space to speed up the training convergence rate. Design/methodology/approach: Firstly, the decay weight function is set in the objective function of the agent’s training to combine both types of methods, and both RL and imitation learning (IL) are considered to guide the agent's behavior when updating the policy. Second, this study designs a coupling utilization method between the demonstration trajectory and the training experience, so that samples from both aspects can be combined during the agent’s learning process, and the utilization rate of the data and the agent’s learning speed can be improved. Findings: The method is superior to other algorithms in terms of convergence speed and decision stability, avoiding training from scratch for reward values, and breaking through the restrictions brought by demonstration data. Originality/value: The agent can adapt to dynamic scenes through exploration and trial-and-error mechanisms based on the experience of demonstrating trajectories. The demonstration data set used in IL and the experience samples obtained in the process of RL are coupled and used to improve the data utilization efficiency and the generalization ability of the agent. © 2024, Emerald Publishing Limited.","Cyber-physical-social systems; Deep reinforcement learning; Imitation learning; Target search; UAV","Antennas; Cyber Physical System; Deep learning; Demonstrations; Learning systems; Reinforcement learning; Aerial vehicle; Cybe-physical-social system; Cyber physicals; Deep reinforcement learning; Imitation learning; Reinforcement learnings; Search method; Social systems; Target search; Vehicle targets; Unmanned aerial vehicles (UAV)","Article","Final","","Scopus","2-s2.0-85188835488"
"Tian B.; Peng H.; Zhou Z.","Tian, Binbin (57299381900); Peng, Hui (36083135200); Zhou, Zaihua (59562988300)","57299381900; 36083135200; 59562988300","GRU-ARX model-based adaptive error compensation predictive control strategy with application to quadrotor","2025","Applied Soft Computing","172","","112829","","","3","10.1016/j.asoc.2025.112829","https://www.scopus.com/inward/record.uri?eid=2-s2.0-85218176619&doi=10.1016%2Fj.asoc.2025.112829&partnerID=40&md5=8dded58bf3734a95c2dc4afea6e1d0a4","For a class of nonlinear dynamic systems, accurately characterizing the dynamic characteristics by building their physical models is still challenging. To deal with this issue, a novel deep learning network architecture, gated recurrent unit (GRU) neural network-based ARX model (GRU-ARX model), is developed in this study. In this model, the GRU network is executed to capture potential nonlinear mapping features of the system. And the pseudo linear ARX structure is adopted for making controller design easier, with the state-dependent parameters updated at each execution point. In view of this model, the model predictive control (MPC) algorithms for controlling the real nonlinear plant can be availably designed. However, faced with the appearance of sensibility with respect to internal or/and external factors in practical applications, the time-varying model may not perform well in control accuracy and robustness specification. Consequently, the operation of selecting the correction coefficients adaptively is combined with the MPC strategy to establish the adaptive MPC protocol focused on the error compensation, allowing for achieving the improved control accuracy and performance. Especially, the designed GRU-ARX model-based control algorithms, without and with the adaptive error compensation law are successfully applied to a practical quadrotor system, and the effectiveness of the accessed algorithms can be demonstrated by comparative results of real-time control experiments. These outcomes showcase that the proposed adaptive error compensation MPC algorithm exhibits superior control performance compared to other model-based controllers in trajectory tracking and anti-interference experiments, revealing its advantages over the traditional MPC algorithm. © 2025 Elsevier B.V.","Adaptive error compensation; GRU-ARX model; Nonlinear MPC; Quadrotor; Real-time control","Adaptive control systems; Deep neural networks; Error compensation; Recurrent neural networks; Time varying control systems; Adaptive error; Adaptive error compensation; ARX model; Gated recurrent unit-ARX model; Model-predictive control; Nonlinear model predictive control; Predictive control algorithm; Predictive control strategy; Quad rotors; Real-time control; Predictive control systems","Article","Final","","Scopus","2-s2.0-85218176619"
"Wen Y.-M.; Shi X.-R.; Huang X.-M.; Yu Y.","Wen, Yong-Ming (55832902000); Shi, Xiao-Rong (7402953348); Huang, Xue-Mei (55266112800); Yu, Yue (57224205474)","55832902000; 7402953348; 55266112800; 57224205474","An Intelligent Decision-Making Method for Multi-Coupling Tasks of UAV Cluster Countermeasure; [一种无人机集群对抗多耦合任务智能决策方法]","2021","Yuhang Xuebao/Journal of Astronautics","42","4","","504","512","14","10.3873/j.issn.1000-1328.2021.04.011","https://www.scopus.com/inward/record.uri?eid=2-s2.0-85107205341&doi=10.3873%2Fj.issn.1000-1328.2021.04.011&partnerID=40&md5=dc6c48eff198ff5d16186f47ba15606e","Aiming at the decision-making problems of multi-coupling tasks such as cooperative target assignment and penetration trajectory planning in UAV cluster countermeasure in complex scenes, an intelligent decision-making method for multi-coupling tasks in UAV cluster countermeasure is proposed. Firstly, aiming at the problems of multi-coupling tasks and large decision-making space in UAV cluster countermeasure, combined with the advantages of centralized and hierarchical architectures, a hybrid deep reinforcement learning architecture for multi-coupling tasks is designed, which can improve the cooperation between the multi-coupling tasks and the effectiveness of cluster countermeasure. Secondly, for the sparse reward problem of sequential decision-making in trajectory planning, a trajectory construction method is designed. Thirdly, aiming at the scene uncertainty problem under the strong countermeasure conditions, based on the UAV cluster red blue countermeasure simulation platform, a red blue game training method based on multiple random scenes is designed, which can enhance the generalization of the strategy network. Finally, by comparing with the traditional method, the centralized architecture method and the hierarchical architecture method, the simulation results show that the effectiveness and the advanced nature of the proposed method are verified. © 2021, Editorial Dept. of JA. All right reserved.","Cooperative target assignment; Deep reinforcement learning; Intelligent decision-making; Penetration trajectory planning; UAV cluster countermeasure","Cluster computing; Deep learning; Network architecture; Reinforcement learning; Trajectories; Unmanned aerial vehicles (UAV); Centralized architecture; Construction method; Cooperative targets; Decision-making problem; Hierarchical architectures; Intelligent decision making; Sequential decision making; Uncertainty problems; Decision making","Article","Final","","Scopus","2-s2.0-85107205341"
